{
  "subject": [
    {
      "type": "latex",
      "uri": "chapters/groups.tex",
      "location": { "label": "thm:index-one" },
      "title": "Theorem 2.6"
    }
  ],
  "object": [
    {
      "type": "lean",
      "uri": "https://github.com/leanprover-community/mathlib4",
      "version": "v4.33.0",
      "location": { "declaration": "Subgroup.index_eq_one", "module": "Mathlib.GroupTheory.Index" }
    }
  ],
  "relation": "hasPart",
  "kind": "theorem",
  "note": "The theorem makes two claims about a subgroup H of a group G: H has index 1 exactly when H = G, and the trivial subgroup has index |G|. Subgroup.index_eq_one states the first."
}
