{
  "subject": [
    {
      "type": "latex",
      "uri": "chapters/fields.tex",
      "location": { "label": "thm:cyclic-units" },
      "title": "Theorem 4.2"
    }
  ],
  "object": [
    {
      "type": "lean",
      "uri": "https://github.com/leanprover-community/mathlib4",
      "version": "v4.33.0",
      "location": { "declaration": "isCyclic_subgroup_units", "module": "Mathlib.RingTheory.IntegralDomain" }
    }
  ],
  "relation": "broadMatch",
  "kind": "theorem",
  "note": "The theorem says that every finite subgroup of the multiplicative group of a field is cyclic. isCyclic_subgroup_units proves it for the units of any integral domain, and every field is an integral domain."
}
