{
  "subject": [
    {
      "type": "html",
      "uri": "sources/C-algebra.html",
      "version": "1374776629",
      "location": { "css": "#mw-content-text .mw-parser-output > section:first-of-type > p:first-of-type" },
      "title": "Definition of a C*-algebra",
      "citation": {
        "id": "wikipedia-c-star-algebra",
        "type": "entry-encyclopedia",
        "title": "C*-algebra",
        "container-title": "Wikipedia",
        "URL": "https://en.wikipedia.org/w/index.php?title=C*-algebra&oldid=1374776629",
        "accessed": { "date-parts": [ [ 2026, 10, 1 ] ] }
      },
      "identifiers": { "wikidata": "Q263809" }
    }
  ],
  "object": [
    {
      "type": "lean",
      "uri": "https://github.com/leanprover-community/mathlib4",
      "version": "v4.33.0",
      "location": { "declaration": "NonUnitalCStarAlgebra", "module": "Mathlib.Analysis.CStarAlgebra.Classes" }
    }
  ],
  "status": "formalized",
  "kind": "definition",
  "id": "d1f0dc66926c",
  "note": "Illustrative record of a formalized definition, not a reviewed claim about Mathlib: the passage defines a C*-algebra without a unit, as NonUnitalCStarAlgebra does; CStarAlgebra is the unital class. The subject opens a local copy of the article and names its revision.",
  "extensions": {
    "org.example.curation": {
      "reviewed": false
    }
  }
}
